{
  "$schema": "http://json-schema.org/draft-07/schema#",
  "title": "Token Response",
  "description": "OAuth2 Response for the request of a Bearer Token",
  "type": "object",
  "properties": {
    "access_token": {
      "description": "Access Token to be used in accessing protected endpoints",
      "type": "string"
    },
    "expires_in": {
      "description": "The UTC time in which the Bearer Token will expire",
      "type": "integer"
    },
    "refresh_token": {
      "description": "Refresh Token to be used to obtain further Access Tokens",
      "type": "string"
    },
    "scope": {
      "description": "The scope of the Access Token",
      "type": "string"
    },
    "token_type": {
      "description": "The form of the Token",
      "type": "string"
    }
  },
  "required": ["access_token", "expires_in", "token_type"]
}
